2026-02-08 06:20:37,266 - INFO - Logging to: /workspaces/ran_sql/logs/ner_training_robust_20260208_062037.log
2026-02-08 06:20:37,267 - INFO - Loading training data...
2026-02-08 06:20:37,284 - INFO - Loaded 3200 samples
2026-02-08 06:20:37,284 - INFO - Converting to spaCy format...
2026-02-08 06:20:37,293 - INFO - Converted 3200 samples (0 skipped due to overlaps)
2026-02-08 06:20:37,294 - INFO - Entity labels: DATE_TIME, KPI_NAME, LOCATION, NUMERIC_VALUE, REGION, SITE_ID
2026-02-08 06:20:37,294 - INFO - Splitting data (80/20)...
2026-02-08 06:20:37,296 - INFO - Training: 2560 samples
2026-02-08 06:20:37,296 - INFO - Test: 640 samples
2026-02-08 06:20:37,296 - INFO - Creating blank NER model...
2026-02-08 06:20:37,522 - INFO - Model created with 6 entity types
2026-02-08 06:20:37,522 - INFO - ====================================================================================================
2026-02-08 06:20:37,522 - INFO - TRAINING START
2026-02-08 06:20:37,522 - INFO - ====================================================================================================
2026-02-08 06:20:37,522 - INFO - Starting training for 50 iterations...
2026-02-08 06:20:37,522 - INFO - Training samples: 2560
2026-02-08 06:20:37,522 - INFO - Test samples: 640
2026-02-08 06:20:37,525 - INFO - Created vocabulary
2026-02-08 06:20:37,525 - INFO - Finished initializing nlp object
2026-02-08 06:21:17,595 - INFO - Iteration 5/50
2026-02-08 06:21:17,599 - INFO -   Loss: 44.5673
2026-02-08 06:21:17,599 - INFO -   Precision: 0.9988
2026-02-08 06:21:17,599 - INFO -   Recall: 1.0000
2026-02-08 06:21:17,600 - INFO -   F1-Score: 0.9994
2026-02-08 06:21:17,646 - INFO -   ✅ New best F1! Checkpoint saved: /workspaces/ran_sql/models/ner/checkpoint_iter_5
2026-02-08 06:21:17,646 - INFO - 
2026-02-08 06:21:55,555 - INFO - Iteration 10/50
2026-02-08 06:21:55,555 - INFO -   Loss: 34.8740
2026-02-08 06:21:55,555 - INFO -   Precision: 0.9988
2026-02-08 06:21:55,555 - INFO -   Recall: 1.0000
2026-02-08 06:21:55,555 - INFO -   F1-Score: 0.9994
2026-02-08 06:21:55,555 - INFO - 
2026-02-08 06:22:33,810 - INFO - Iteration 15/50
2026-02-08 06:22:33,810 - INFO -   Loss: 42.6701
2026-02-08 06:22:33,810 - INFO -   Precision: 0.9988
2026-02-08 06:22:33,811 - INFO -   Recall: 1.0000
2026-02-08 06:22:33,811 - INFO -   F1-Score: 0.9994
2026-02-08 06:22:33,811 - INFO - 
2026-02-08 06:23:13,365 - INFO - Iteration 20/50
2026-02-08 06:23:13,366 - INFO -   Loss: 30.8554
2026-02-08 06:23:13,366 - INFO -   Precision: 0.9988
2026-02-08 06:23:13,366 - INFO -   Recall: 1.0000
2026-02-08 06:23:13,366 - INFO -   F1-Score: 0.9994
2026-02-08 06:23:13,366 - INFO - 
2026-02-08 06:23:52,786 - INFO - Iteration 25/50
2026-02-08 06:23:52,786 - INFO -   Loss: 20.2865
2026-02-08 06:23:52,786 - INFO -   Precision: 0.9988
2026-02-08 06:23:52,786 - INFO -   Recall: 1.0000
2026-02-08 06:23:52,786 - INFO -   F1-Score: 0.9994
2026-02-08 06:23:52,786 - INFO - 
2026-02-08 06:24:32,062 - INFO - Iteration 30/50
2026-02-08 06:24:32,063 - INFO -   Loss: 10.7679
2026-02-08 06:24:32,063 - INFO -   Precision: 0.9988
2026-02-08 06:24:32,063 - INFO -   Recall: 1.0000
2026-02-08 06:24:32,063 - INFO -   F1-Score: 0.9994
2026-02-08 06:24:32,063 - INFO - 
2026-02-08 06:25:11,940 - INFO - Iteration 35/50
2026-02-08 06:25:11,940 - INFO -   Loss: 18.0269
2026-02-08 06:25:11,940 - INFO -   Precision: 0.9988
2026-02-08 06:25:11,940 - INFO -   Recall: 1.0000
2026-02-08 06:25:11,940 - INFO -   F1-Score: 0.9994
2026-02-08 06:25:11,940 - INFO - 
2026-02-08 06:25:51,396 - INFO - Iteration 40/50
2026-02-08 06:25:51,396 - INFO -   Loss: 10.2383
2026-02-08 06:25:51,396 - INFO -   Precision: 0.9988
2026-02-08 06:25:51,396 - INFO -   Recall: 1.0000
2026-02-08 06:25:51,396 - INFO -   F1-Score: 0.9994
2026-02-08 06:25:51,397 - INFO - 
2026-02-08 06:26:31,004 - INFO - Iteration 45/50
2026-02-08 06:26:31,004 - INFO -   Loss: 21.4761
2026-02-08 06:26:31,005 - INFO -   Precision: 0.9988
2026-02-08 06:26:31,005 - INFO -   Recall: 1.0000
2026-02-08 06:26:31,005 - INFO -   F1-Score: 0.9994
2026-02-08 06:26:31,005 - INFO - 
2026-02-08 06:27:11,874 - INFO - Iteration 50/50
2026-02-08 06:27:11,875 - INFO -   Loss: 6.7542
2026-02-08 06:27:11,875 - INFO -   Precision: 0.9988
2026-02-08 06:27:11,875 - INFO -   Recall: 1.0000
2026-02-08 06:27:11,875 - INFO -   F1-Score: 0.9994
2026-02-08 06:27:11,875 - INFO - 
2026-02-08 06:27:11,875 - INFO - Training completed!
2026-02-08 06:27:11,875 - INFO - ====================================================================================================
2026-02-08 06:27:11,875 - INFO - FINAL EVALUATION
2026-02-08 06:27:11,875 - INFO - ====================================================================================================
2026-02-08 06:27:12,950 - INFO - Precision: 0.9988
2026-02-08 06:27:12,950 - INFO - Recall: 1.0000
2026-02-08 06:27:12,950 - INFO - F1-Score: 0.9994
2026-02-08 06:27:12,950 - INFO - Best F1 during training: 0.9994
2026-02-08 06:27:12,989 - INFO - Final model saved: /workspaces/ran_sql/models/ner/ran_ner_model_robust
2026-02-08 06:27:12,989 - INFO - Metrics saved: /workspaces/ran_sql/models/ner/ner_metrics_robust.json
